{
  "$schema": "https://json-schema.org/draft/2020-12/schema",
  "$id": "https://schemas.example.invalid/webhook-receiver-conformance/v1/observer-request.schema.json",
  "title": "Observer protocol request",
  "type": "object",
  "required": [
    "protocol_version",
    "request_id",
    "operation"
  ],
  "properties": {
    "protocol_version": {
      "const": "1.0"
    },
    "request_id": {
      "$ref": "#/$defs/id"
    },
    "sample_id": {
      "$ref": "#/$defs/id"
    },
    "operation": {
      "enum": [
        "capabilities",
        "observe"
      ]
    },
    "run_id": {
      "oneOf": [
        {
          "$ref": "#/$defs/uuid_v4"
        },
        {
          "type": "null"
        }
      ]
    },
    "scenario_id": {
      "oneOf": [
        {
          "$ref": "#/$defs/id"
        },
        {
          "type": "null"
        }
      ]
    },
    "event_id": {
      "oneOf": [
        {
          "$ref": "#/$defs/id"
        },
        {
          "type": "null"
        }
      ]
    },
    "checkpoint": {
      "type": [
        "string",
        "null"
      ]
    },
    "prior_snapshot_id": {
      "type": [
        "string",
        "null"
      ],
      "minLength": 1,
      "maxLength": 512
    },
    "queries": {
      "type": "array",
      "maxItems": 64,
      "items": {
        "type": "object",
        "required": [
          "key",
          "type"
        ],
        "properties": {
          "key": {
            "type": "string"
          },
          "type": {
            "type": "string"
          },
          "parameters": {
            "type": "object"
          }
        },
        "additionalProperties": false
      }
    }
  },
  "allOf": [
    {
      "if": {
        "properties": {
          "operation": {
            "const": "observe"
          }
        },
        "required": [
          "operation"
        ]
      },
      "then": {
        "required": [
          "sample_id",
          "run_id",
          "queries"
        ],
        "properties": {
          "run_id": {
            "$ref": "#/$defs/uuid_v4"
          },
          "queries": {
            "minItems": 1
          }
        }
      }
    }
  ],
  "additionalProperties": false,
  "$defs": {
    "id": {
      "type": "string",
      "pattern": "^[a-z][a-z0-9]*(?:_[a-z0-9]+)*_[0-9A-HJKMNP-TV-Z]{26}$",
      "maxLength": 96
    },
    "uuid_v4": {
      "type": "string",
      "pattern": "^[0-9a-f]{8}-[0-9a-f]{4}-4[0-9a-f]{3}-[89ab][0-9a-f]{3}-[0-9a-f]{12}$"
    },
    "sha256": {
      "type": "string",
      "pattern": "^sha256:[0-9a-f]{64}$"
    },
    "utc": {
      "type": "string",
      "pattern": "^\\d{4}-\\d{2}-\\d{2}T\\d{2}:\\d{2}:\\d{2}(?:\\.\\d{1,9})?Z$"
    },
    "json_value": {},
    "secret_ref": {
      "oneOf": [
        {
          "type": "object",
          "required": [
            "env"
          ],
          "properties": {
            "env": {
              "type": "string",
              "pattern": "^[A-Z][A-Z0-9_]{0,127}$"
            }
          },
          "additionalProperties": false
        },
        {
          "type": "object",
          "required": [
            "file"
          ],
          "properties": {
            "file": {
              "type": "string",
              "minLength": 1
            }
          },
          "additionalProperties": false
        },
        {
          "type": "object",
          "required": [
            "generated"
          ],
          "properties": {
            "generated": {
              "enum": [
                "hmac-256",
                "ed25519-test"
              ]
            }
          },
          "additionalProperties": false
        }
      ]
    },
    "duration": {
      "type": "string",
      "pattern": "^(?:0|[1-9]\\d*)(?:ns|us|ms|s|m|h)$",
      "description": "Non-negative integer duration with an explicit unit; floating-point durations are prohibited."
    }
  }
}
